{
  "$schema": "https://json-schema.org/draft/2020-12/schema",
  "$id": "drift-event.schema.json",
  "title": "Drift Event",
  "description": "Records a declared drift observation. Material drift requires reassessment. This record does not retrain or promote a model.",
  "type": "object",
  "additionalProperties": false,
  "properties": {
    "schema_version": {
      "type": "string",
      "const": "1.0.0",
      "minLength": 1
    },
    "event_id": {
      "type": "string",
      "minLength": 1
    },
    "subject_id": {
      "type": "string",
      "minLength": 1
    },
    "configuration_digest": {
      "type": "string",
      "pattern": "^sha256:[a-f0-9]{64}$"
    },
    "drift_type": {
      "type": "string",
      "enum": [
        "DATA",
        "CONCEPT",
        "LABEL",
        "FEATURE",
        "PERFORMANCE",
        "CALIBRATION",
        "POPULATION",
        "ENVIRONMENT"
      ],
      "minLength": 1
    },
    "detected_at": {
      "type": "string",
      "pattern": "^\\d{4}-\\d{2}-\\d{2}T\\d{2}:\\d{2}:\\d{2}Z$"
    },
    "detector_ref": {
      "type": "string",
      "minLength": 1
    },
    "material": {
      "type": "boolean"
    },
    "reassessment_required": {
      "type": "boolean"
    },
    "limitations": {
      "type": "array",
      "minItems": 1,
      "items": {
        "type": "string",
        "minLength": 1
      }
    },
    "reference_only": {
      "type": "boolean",
      "const": true
    },
    "authority_effect": {
      "type": "string",
      "const": "NONE",
      "minLength": 1
    }
  },
  "required": [
    "schema_version",
    "event_id",
    "subject_id",
    "configuration_digest",
    "drift_type",
    "detected_at",
    "detector_ref",
    "material",
    "reassessment_required",
    "limitations",
    "reference_only",
    "authority_effect"
  ]
}
